<?xml version="1.0"?>
<!DOCTYPE database SYSTEM "http://db.apache.org/torque/dtd/database.dtd">
<database name="testdb">
	<table name="author">
		<column name="pk" type="INTEGER" key="primary" auto-increment="true" />
		<column name="name" type="VARCHAR" size="35" required="true" />
		<column name="organisation" type="VARCHAR" size="50" required="false" />
	</table>
	<table name="book">
		<column name="pk" type="INTEGER" key="primary" auto-increment="true" />
		<column name="isbn" type="VARCHAR" size="15" />
		<column name="author_pk" type="INTEGER" />
		<column name="title" type="VARCHAR" size="255" default="N/A" />
		<foreign-key foreignTable="author">
			<reference local="author_id" foreign="author_id"/>
		</foreign-key>
	</table>
	<index name="book_isbn">
		<column name="isbn" />
	</index>
	</table>
</database>